{
  "corpus_summary": {
    "documents_extracted": 2,
    "documents_failed": 0,
    "paths_skipped": 1,
    "source_manifest_sha256": "ce8b9bf05d93fdc349bf8be28005272bf6176933dbbbf160d1c31b69afd301c3"
  },
  "limitations": [
    "Lexical retrieval does not establish semantic relevance or theorem validity.",
    "No-match results may reflect different terminology or incomplete source material.",
    "PDF line numbers refer to deterministic pdftotext extraction; page numbers are also recorded when available."
  ],
  "query_results": [
    {
      "id": "subtraction",
      "matched": true,
      "mode": "all_terms",
      "passage_count": 1,
      "passages": [
        {
          "citation": "sample_spec.md:L10-L12",
          "document_sha256": "276d2144b21af6aeeb3694a710014e6bb8cc275f68b09478763e7bd03c725511",
          "end_line": 12,
          "end_page": null,
          "heading": {
            "line": 9,
            "page": null,
            "text": "## 2 Polynomial operations"
          },
          "matched_lines": [
            11
          ],
          "path": "sample_spec.md",
          "start_line": 10,
          "start_page": null,
          "text": "\nPolynomial subtraction computes a result coefficient from corresponding input coefficients.\nThe operation is interpreted coefficient-wise before any representation-specific reduction."
        }
      ],
      "raw_matching_line_count": 1,
      "required": true,
      "text": "polynomial subtraction",
      "truncated": false
    },
    {
      "id": "modulus",
      "matched": true,
      "mode": "literal",
      "passage_count": 2,
      "passages": [
        {
          "citation": "notes.txt:L1-L3",
          "document_sha256": "59a1e71b2e16f9cad8ae1ecaba8c3f5f50c4b2a37edbb3366ef9e2ad4b1597fa",
          "end_line": 3,
          "end_page": null,
          "heading": null,
          "matched_lines": [
            2
          ],
          "path": "notes.txt",
          "start_line": 1,
          "start_page": null,
          "text": "Supplementary fixture notes.\nThe modulus value 3329 appears here as a repeated lexical fact.\nNo implementation theorem is stated by this fixture."
        },
        {
          "citation": "sample_spec.md:L6-L8",
          "document_sha256": "276d2144b21af6aeeb3694a710014e6bb8cc275f68b09478763e7bd03c725511",
          "end_line": 8,
          "end_page": null,
          "heading": {
            "line": 5,
            "page": null,
            "text": "## 1 Parameters"
          },
          "matched_lines": [
            7
          ],
          "path": "sample_spec.md",
          "start_line": 6,
          "start_page": null,
          "text": "\nThe fixed polynomial degree is 256 and the coefficient modulus is 3329.\n"
        }
      ],
      "raw_matching_line_count": 2,
      "required": true,
      "text": "3329",
      "truncated": false
    }
  ],
  "request": {
    "options": {
      "case_sensitive": false,
      "context_lines": 1,
      "max_matches_per_query": 10
    },
    "queries": [
      {
        "id": "subtraction",
        "mode": "all_terms",
        "required": true,
        "text": "polynomial subtraction"
      },
      {
        "id": "modulus",
        "mode": "literal",
        "required": true,
        "text": "3329"
      }
    ],
    "request_id": "fixture-valid",
    "schema_version": "1.0",
    "target": {
      "source_file": "mlkem/poly.c",
      "symbol": "mlk_poly_sub"
    }
  },
  "schema_version": "1.0",
  "semantic_authority": "NONE",
  "skill": {
    "name": "mlkem-spec-grounding",
    "version": "1.0.0-rc1"
  },
  "status": "COMPLETE_WITH_WARNINGS",
  "timestamp_policy": "omitted_for_byte_reproducibility",
  "warnings": [
    "Skipped 1 source path(s); inspect source_manifest.json."
  ]
}
